{
  "$schema": "https://json-schema.org/draft/2020-12/schema",
  "$id": "https://github.com/mcpp-community/lsp-mcpp/specs/schema/s1-build-database/0.2.0",
  "title": "C++ Build Database: IDE Profile 0.2.0 (S1)",
  "description": "A P2977R2-compatible build database with the IDE profile fields of S1. Unknown fields are permitted everywhere; consumers ignore them.",
  "type": "object",
  "required": ["version", "revision", "sets"],
  "properties": {
    "version": { "const": 1 },
    "revision": { "type": "integer", "minimum": 0 },
    "ide": { "$ref": "#/$defs/documentIde" },
    "sets": {
      "type": "array",
      "items": { "$ref": "#/$defs/set" }
    }
  },
  "$defs": {
    "stringArray": {
      "type": "array",
      "items": { "type": "string" }
    },
    "nonEmptyString": {
      "type": "string",
      "minLength": 1
    },
    "extensions": {
      "type": "object",
      "description": "Vendor extensions keyed by reverse domain name or registered short name."
    },
    "documentIde": {
      "type": "object",
      "required": ["profile-version", "toolchains"],
      "properties": {
        "profile-version": {
          "type": "string",
          "pattern": "^(0|[1-9][0-9]*)\\.(0|[1-9][0-9]*)\\.(0|[1-9][0-9]*)(-[0-9A-Za-z.-]+)?(\\+[0-9A-Za-z.-]+)?$"
        },
        "generator": {
          "type": "object",
          "required": ["name"],
          "properties": {
            "name": { "$ref": "#/$defs/nonEmptyString" },
            "version": { "type": "string" }
          }
        },
        "toolchains": {
          "type": "object",
          "additionalProperties": { "$ref": "#/$defs/toolchain" }
        },
        "extensions": { "$ref": "#/$defs/extensions" }
      }
    },
    "toolchain": {
      "type": "object",
      "required": ["family", "version", "driver", "target"],
      "properties": {
        "family": { "enum": ["gcc", "clang", "msvc", "clang-cl", "other"] },
        "version": { "$ref": "#/$defs/nonEmptyString" },
        "build-id": { "type": "string" },
        "driver": { "$ref": "#/$defs/nonEmptyString" },
        "target": { "$ref": "#/$defs/nonEmptyString" },
        "sysroot": { "type": "string" },
        "stdlib": { "$ref": "#/$defs/stdlib" },
        "config-files": { "$ref": "#/$defs/stringArray" },
        "introspection": {
          "type": "array",
          "items": {
            "type": "object",
            "required": ["command"],
            "properties": {
              "command": {
                "type": "array",
                "minItems": 1,
                "items": { "type": "string" }
              },
              "output": { "type": "string" }
            }
          }
        }
      }
    },
    "stdlib": {
      "type": "object",
      "required": ["name", "module-metadata"],
      "properties": {
        "name": { "enum": ["libstdc++", "libc++", "msvc-stl", "other"] },
        "version": { "type": "string" },
        "module-metadata": { "$ref": "#/$defs/nonEmptyString" }
      }
    },
    "set": {
      "type": "object",
      "required": ["name", "visible-sets", "translation-units"],
      "properties": {
        "name": { "$ref": "#/$defs/nonEmptyString" },
        "family-name": { "type": "string" },
        "visible-sets": {
          "type": "array",
          "items": { "$ref": "#/$defs/nonEmptyString" },
          "uniqueItems": true
        },
        "baseline-arguments": { "$ref": "#/$defs/stringArray" },
        "translation-units": {
          "type": "array",
          "items": { "$ref": "#/$defs/translationUnit" }
        },
        "ide": { "$ref": "#/$defs/setIde" }
      }
    },
    "setIde": {
      "type": "object",
      "required": ["toolchain"],
      "properties": {
        "toolchain": { "$ref": "#/$defs/nonEmptyString" },
        "configuration": { "type": "string" },
        "kind": { "enum": ["library", "executable", "test", "other"] },
        "options": { "$ref": "#/$defs/semanticOptions" },
        "module-metadata": {
          "type": "array",
          "items": { "$ref": "#/$defs/nonEmptyString" }
        },
        "extensions": { "$ref": "#/$defs/extensions" }
      }
    },
    "translationUnit": {
      "type": "object",
      "required": ["source", "work-directory", "arguments"],
      "properties": {
        "source": { "$ref": "#/$defs/nonEmptyString" },
        "work-directory": { "$ref": "#/$defs/nonEmptyString" },
        "arguments": {
          "type": "array",
          "minItems": 1,
          "items": { "type": "string" }
        },
        "local-arguments": { "$ref": "#/$defs/stringArray" },
        "object": { "type": "string" },
        "private": { "type": "boolean" },
        "provides": {
          "type": "object",
          "propertyNames": { "$ref": "#/$defs/moduleName" },
          "additionalProperties": { "type": "string" }
        },
        "requires": {
          "type": "array",
          "items": { "$ref": "#/$defs/moduleName" },
          "uniqueItems": true
        },
        "ide": { "$ref": "#/$defs/unitIde" }
      }
    },
    "moduleName": {
      "type": "string",
      "description": "A module name M or a partition name M:P, where M and P are dot-separated identifiers. Identifier characters are not restricted to ASCII.",
      "pattern": "^[^\\s:.]+(\\.[^\\s:.]+)*(:[^\\s:.]+(\\.[^\\s:.]+)*)?$"
    },
    "unitIde": {
      "type": "object",
      "required": ["role"],
      "properties": {
        "role": { "$ref": "#/$defs/role" },
        "options": { "$ref": "#/$defs/semanticOptions" },
        "extensions": { "$ref": "#/$defs/extensions" }
      }
    },
    "role": {
      "enum": [
        "module-interface",
        "module-partition-interface",
        "module-partition-implementation",
        "module-implementation",
        "non-module",
        "unknown",
        "header-unit"
      ]
    },
    "macro": {
      "oneOf": [
        {
          "type": "object",
          "required": ["define"],
          "not": { "required": ["undefine"] },
          "properties": {
            "define": { "$ref": "#/$defs/nonEmptyString" },
            "value": { "type": ["string", "null"] }
          }
        },
        {
          "type": "object",
          "required": ["undefine"],
          "not": { "required": ["define"] },
          "properties": {
            "undefine": { "$ref": "#/$defs/nonEmptyString" }
          }
        }
      ]
    },
    "includeDirectories": {
      "type": "object",
      "properties": {
        "user": { "$ref": "#/$defs/stringArray" },
        "quote": { "$ref": "#/$defs/stringArray" },
        "system": { "$ref": "#/$defs/stringArray" },
        "after": { "$ref": "#/$defs/stringArray" }
      }
    },
    "semanticOptions": {
      "type": "object",
      "properties": {
        "language-standard": { "type": "string", "pattern": "^c\\+\\+[0-9a-z]+$" },
        "language-extensions": { "enum": ["none", "gnu", "ms"] },
        "macros": {
          "type": "array",
          "items": { "$ref": "#/$defs/macro" }
        },
        "include-directories": { "$ref": "#/$defs/includeDirectories" },
        "forced-includes": { "$ref": "#/$defs/stringArray" },
        "exceptions": { "type": "boolean" },
        "rtti": { "type": "boolean" },
        "raw-semantic-arguments": {
          "type": "object",
          "propertyNames": { "enum": ["gcc", "clang", "msvc", "clang-cl", "other"] },
          "additionalProperties": { "$ref": "#/$defs/stringArray" }
        }
      }
    }
  }
}
